{
  "meta": {
    "case_id": "ai_agent_practicalization",
    "case_title": "AI Agent Practicalization",
    "topic_tag": "ai_agent_practicalization",
    "contract_version": "2026-03-24.v1",
    "fixture_id": "golden-ai-agent-practicalization-v1",
    "generated_at": "2026-03-24T12:30:00Z",
    "bucket_granularity": "day",
    "analysis_window_start": "2026-03-10",
    "analysis_window_end": "2026-03-12",
    "source_platforms": ["bilibili", "xiaohongshu"],
    "default_model_id": "bass_diffusion",
    "available_models": [
      { "id": "bass_diffusion", "label": "Bass Diffusion", "category": "diffusion", "description": "Diffusion-oriented model." },
      { "id": "gompertz", "label": "Gompertz", "category": "saturation", "description": "Saturation-oriented model." }
    ]
  },
  "stream": {
    "storylines": [
      {
        "storyline_id": "st_001",
        "topic_tag": "ai_agent_practicalization",
        "storyline_label": "务实落地线",
        "title": "AI Agent 正向工作流与系统集成落地收敛",
        "summary": "围绕 Agent 的有效叙事开始转向工作流编排和业务系统集成。",
        "summary_source": "llm",
        "logic_status": "stable",
        "evidence_posture": "grounded",
        "support_count": 2,
        "viewpoint_count": 1,
        "comment_count": 2,
        "keywords": ["workflow", "integration", "ops"],
        "display_rank": 1,
        "display_tier": "primary",
        "metadata": {}
      },
      {
        "storyline_id": "st_002",
        "topic_tag": "ai_agent_practicalization",
        "storyline_label": "部署摩擦线",
        "title": "成本与维护压力仍在压制 Agent 部署",
        "summary": "部署和维护成本仍然是大规模落地的关键阻力。",
        "summary_source": "llm",
        "logic_status": "emerging",
        "evidence_posture": "grounded",
        "support_count": 1,
        "viewpoint_count": 1,
        "comment_count": 1,
        "keywords": ["cost", "ops", "friction"],
        "display_rank": 2,
        "display_tier": "secondary",
        "metadata": {}
      }
    ],
    "storyline_snapshots": [
      { "snapshot_id": "st_snap_001", "storyline_id": "st_001", "bucket_index": 0, "bucket_start": "2026-03-10", "bucket_granularity": "day", "support_count": 1, "comment_count": 1, "viewpoint_ids": ["vp_001"], "storyline_heat_index": 43, "top_viewpoint_ids": ["vp_001"], "metadata": {} },
      { "snapshot_id": "st_snap_002", "storyline_id": "st_001", "bucket_index": 1, "bucket_start": "2026-03-11", "bucket_granularity": "day", "support_count": 2, "comment_count": 2, "viewpoint_ids": ["vp_001"], "storyline_heat_index": 66, "top_viewpoint_ids": ["vp_001"], "metadata": {} },
      { "snapshot_id": "st_snap_003", "storyline_id": "st_002", "bucket_index": 0, "bucket_start": "2026-03-10", "bucket_granularity": "day", "support_count": 0, "comment_count": 0, "viewpoint_ids": [], "storyline_heat_index": 15, "top_viewpoint_ids": [], "metadata": {} },
      { "snapshot_id": "st_snap_004", "storyline_id": "st_002", "bucket_index": 1, "bucket_start": "2026-03-11", "bucket_granularity": "day", "support_count": 0, "comment_count": 0, "viewpoint_ids": [], "storyline_heat_index": 18, "top_viewpoint_ids": [], "metadata": {} },
      { "snapshot_id": "st_snap_005", "storyline_id": "st_002", "bucket_index": 2, "bucket_start": "2026-03-12", "bucket_granularity": "day", "support_count": 1, "comment_count": 1, "viewpoint_ids": ["vp_002"], "storyline_heat_index": 52, "top_viewpoint_ids": ["vp_002"], "metadata": {} }
    ],
    "forecast_series": [
      {
        "storyline_id": "st_001",
        "model_id": "bass_diffusion",
        "model_label": "Bass Diffusion",
        "target_metric": "storylineHeatIndex",
        "historical_points": [
          { "bucket_index": 0, "bucket_start": "2026-03-10", "bucket_granularity": "day", "value": 43, "confidence_low": 43, "confidence_high": 43, "confidence_score": 1, "is_forecast": false },
          { "bucket_index": 1, "bucket_start": "2026-03-11", "bucket_granularity": "day", "value": 66, "confidence_low": 66, "confidence_high": 66, "confidence_score": 1, "is_forecast": false }
        ],
        "forecast_points": [
          { "bucket_index": 2, "bucket_start": "2026-03-12", "bucket_granularity": "day", "value": 74, "confidence_low": 68, "confidence_high": 80, "confidence_score": 0.82, "is_forecast": true },
          { "bucket_index": 3, "bucket_start": "2026-03-13", "bucket_granularity": "day", "value": 79, "confidence_low": 71, "confidence_high": 85, "confidence_score": 0.72, "is_forecast": true }
        ],
        "explanation": "Bass 模型认为务实落地线仍处于扩散阶段。",
        "metadata": {}
      },
      {
        "storyline_id": "st_001",
        "model_id": "gompertz",
        "model_label": "Gompertz",
        "target_metric": "storylineHeatIndex",
        "historical_points": [
          { "bucket_index": 0, "bucket_start": "2026-03-10", "bucket_granularity": "day", "value": 43, "confidence_low": 43, "confidence_high": 43, "confidence_score": 1, "is_forecast": false },
          { "bucket_index": 1, "bucket_start": "2026-03-11", "bucket_granularity": "day", "value": 66, "confidence_low": 66, "confidence_high": 66, "confidence_score": 1, "is_forecast": false }
        ],
        "forecast_points": [
          { "bucket_index": 2, "bucket_start": "2026-03-12", "bucket_granularity": "day", "value": 71, "confidence_low": 66, "confidence_high": 76, "confidence_score": 0.8, "is_forecast": true },
          { "bucket_index": 3, "bucket_start": "2026-03-13", "bucket_granularity": "day", "value": 74, "confidence_low": 68, "confidence_high": 79, "confidence_score": 0.69, "is_forecast": true }
        ],
        "explanation": "Gompertz 模型认为增长会更快进入饱和区间。",
        "metadata": {}
      },
      {
        "storyline_id": "st_002",
        "model_id": "bass_diffusion",
        "model_label": "Bass Diffusion",
        "target_metric": "storylineHeatIndex",
        "historical_points": [
          { "bucket_index": 0, "bucket_start": "2026-03-10", "bucket_granularity": "day", "value": 15, "confidence_low": 15, "confidence_high": 15, "confidence_score": 1, "is_forecast": false },
          { "bucket_index": 1, "bucket_start": "2026-03-11", "bucket_granularity": "day", "value": 18, "confidence_low": 18, "confidence_high": 18, "confidence_score": 1, "is_forecast": false },
          { "bucket_index": 2, "bucket_start": "2026-03-12", "bucket_granularity": "day", "value": 52, "confidence_low": 52, "confidence_high": 52, "confidence_score": 1, "is_forecast": false }
        ],
        "forecast_points": [
          { "bucket_index": 3, "bucket_start": "2026-03-13", "bucket_granularity": "day", "value": 57, "confidence_low": 49, "confidence_high": 63, "confidence_score": 0.67, "is_forecast": true },
          { "bucket_index": 4, "bucket_start": "2026-03-14", "bucket_granularity": "day", "value": 60, "confidence_low": 51, "confidence_high": 66, "confidence_score": 0.58, "is_forecast": true }
        ],
        "explanation": "Bass 模型认为部署摩擦仍会继续扩散。",
        "metadata": {}
      },
      {
        "storyline_id": "st_002",
        "model_id": "gompertz",
        "model_label": "Gompertz",
        "target_metric": "storylineHeatIndex",
        "historical_points": [
          { "bucket_index": 0, "bucket_start": "2026-03-10", "bucket_granularity": "day", "value": 15, "confidence_low": 15, "confidence_high": 15, "confidence_score": 1, "is_forecast": false },
          { "bucket_index": 1, "bucket_start": "2026-03-11", "bucket_granularity": "day", "value": 18, "confidence_low": 18, "confidence_high": 18, "confidence_score": 1, "is_forecast": false },
          { "bucket_index": 2, "bucket_start": "2026-03-12", "bucket_granularity": "day", "value": 52, "confidence_low": 52, "confidence_high": 52, "confidence_score": 1, "is_forecast": false }
        ],
        "forecast_points": [
          { "bucket_index": 3, "bucket_start": "2026-03-13", "bucket_granularity": "day", "value": 54, "confidence_low": 48, "confidence_high": 59, "confidence_score": 0.65, "is_forecast": true },
          { "bucket_index": 4, "bucket_start": "2026-03-14", "bucket_granularity": "day", "value": 56, "confidence_low": 49, "confidence_high": 60, "confidence_score": 0.55, "is_forecast": true }
        ],
        "explanation": "Gompertz 模型认为部署摩擦会更早趋于平缓。",
        "metadata": {}
      }
    ]
  },
  "neural_map": {
    "viewpoints": [
      {
        "viewpoint_id": "vp_001",
        "topic_tag": "pragmatic_adoption",
        "viewpoint_label": "工作流与集成落地",
        "title": "务实场景中的工作流和系统集成让 Agent 变得可用",
        "claim_statement": "AI Agent 的可落地价值主要来自半自动工作流和业务系统集成。",
        "summary": "讨论把 Agent 的真实价值定位为工作流编排和系统集成，而不是全自动通用代理。",
        "summary_source": "llm",
        "summary_grounding_score": 0.92,
        "claim_ids": ["claim_001", "claim_002"],
        "comment_ids": ["norm_001", "norm_002"],
        "representative_claim_ids": ["claim_001", "claim_002"],
        "evidence_comment_ids": ["norm_001", "norm_002"],
        "support_count": 2,
        "unique_comment_count": 2,
        "keywords": ["workflow", "integration", "pragmatic"],
        "metadata": {}
      },
      {
        "viewpoint_id": "vp_002",
        "topic_tag": "deployment_friction",
        "viewpoint_label": "成本与运维摩擦",
        "title": "部署和维护成本继续拖慢 Agent 扩张",
        "claim_statement": "部署与维护成本是当前 AI Agent 规模化落地的主要阻力。",
        "summary": "即使落地路径更清晰，部署与维护压力仍然抑制了 Agent 的扩张速度。",
        "summary_source": "llm",
        "summary_grounding_score": 0.89,
        "claim_ids": ["claim_003"],
        "comment_ids": ["norm_003"],
        "representative_claim_ids": ["claim_003"],
        "evidence_comment_ids": ["norm_003"],
        "support_count": 1,
        "unique_comment_count": 1,
        "keywords": ["cost", "maintenance", "friction"],
        "metadata": {}
      }
    ],
    "viewpoint_snapshots": [